{
  "schema_version": "motion-os.golden-9d-qualification-manifest/v1",
  "program_id": "screenrecording_20260826-golden-scenes-9d-v1",
  "authority_rule": "PHYSICALLY_MEASURED > DETERMINISTIC_HEURISTIC > EVIDENCE_BOUND_INFERENCE > EXPLICIT_ASSUMPTION > UNKNOWN",
  "promotion_rule": "All required claims in all nine dimensions must independently QUALIFY. No aggregate score, layout proxy, exact-head CI result or renderer success may compensate for a blocked dimension.",
  "scenes": [
    {"scene_id":"S04_CIENTIFICAMENTE","pr":96,"head_sha":"8ec35a259399d7b196b40627d782315a019e65e2"},
    {"scene_id":"S11_UI_LIST","pr":107,"head_sha":"988e91893cb498f720b9c2656b3d6d85f2d56300"},
    {"scene_id":"S14_AUDIO_VISUAL_TEXTO","pr":124,"head_sha":"12592bd8f8149767fafcb0ad0aa6036250ce540c"},
    {"scene_id":"S16_FACTOR_X","pr":125,"head_sha":"8e6fcb79d0d7958c0f023f128297059c97a7e674"}
  ],
  "evidence": [
    {"evidence_id":"S04_EXACT_ARTIFACT","scene_id":"S04_CIENTIFICAMENTE","kind":"workflow_artifact","authority":"PHYSICALLY_MEASURED","revision":"8ec35a259399d7b196b40627d782315a019e65e2","uri":"github:artifact:9802271767","digest":"sha256:338318f80fb52e5567f2c6efe2b2cdb6ec0d704e28c30317e08cff67b4604bdf"},
    {"evidence_id":"S04_OUTPUT_EQUIV","scene_id":"S04_CIENTIFICAMENTE","kind":"output_equivalence_proof","authority":"PHYSICALLY_MEASURED","revision":"8ec35a259399d7b196b40627d782315a019e65e2","uri":"github:pr:96","notes":"Exact-head artifact was physically compared with the previously qualified renderer output; PR #96 records 85/85 internal files, MP4, overlays, samples and verifier evidence byte-identical."},
    {"evidence_id":"S04_SOURCE_QUAL","scene_id":"S04_CIENTIFICAMENTE","kind":"source_bound_qualification","authority":"PHYSICALLY_MEASURED","revision":"0790a005f391327b731464d269e42864c64ea4cb","uri":"github:file:forensics/references/screenrecording_20260826/golden/s04/fidelity/s04_fidelity_current.json@8ec35a259399d7b196b40627d782315a019e65e2","equivalence_proof_id":"S04_OUTPUT_EQUIV"},

    {"evidence_id":"S11_EXACT_ARTIFACT","scene_id":"S11_UI_LIST","kind":"workflow_artifact","authority":"PHYSICALLY_MEASURED","revision":"988e91893cb498f720b9c2656b3d6d85f2d56300","uri":"github:artifact:9802633943","digest":"sha256:01c0823bd1e4f35b8ce2d47c11959fccf89f8d69098f3561ca596e81299ad874"},
    {"evidence_id":"S11_OUTPUT_EQUIV","scene_id":"S11_UI_LIST","kind":"output_equivalence_proof","authority":"PHYSICALLY_MEASURED","revision":"988e91893cb498f720b9c2656b3d6d85f2d56300","uri":"github:file:forensics/references/screenrecording_20260826/golden/aggregate_9d/cross_scene_output_equivalence.json","notes":"141/141 internal artifact files are byte-identical between qualified artifact 9777929157 and exact-head artifact 9802633943."},
    {"evidence_id":"S11_SOURCE_QUAL","scene_id":"S11_UI_LIST","kind":"source_bound_qualification","authority":"PHYSICALLY_MEASURED","revision":"7cfe7bbd272b2adb65b4bea4792a67e4c91a5f7a","uri":"github:file:forensics/references/screenrecording_20260826/golden/s11/fidelity/s11_postrepair_qualification.json@988e91893cb498f720b9c2656b3d6d85f2d56300","equivalence_proof_id":"S11_OUTPUT_EQUIV"},

    {"evidence_id":"S14_EXACT_ARTIFACT","scene_id":"S14_AUDIO_VISUAL_TEXTO","kind":"workflow_artifact","authority":"PHYSICALLY_MEASURED","revision":"12592bd8f8149767fafcb0ad0aa6036250ce540c","uri":"github:artifact:9781727915","digest":"sha256:42cef4cb4c2ff26f0c8fffbb87dcf1933e9406049a29d7d74e71ba5519733df8"},
    {"evidence_id":"S14_OUTPUT_EQUIV","scene_id":"S14_AUDIO_VISUAL_TEXTO","kind":"output_equivalence_proof","authority":"PHYSICALLY_MEASURED","revision":"12592bd8f8149767fafcb0ad0aa6036250ce540c","uri":"github:file:forensics/references/screenrecording_20260826/golden/aggregate_9d/cross_scene_output_equivalence.json","notes":"105/105 internal artifact files are byte-identical between qualified artifact 9781474661 and exact-head artifact 9781727915."},
    {"evidence_id":"S14_VISIBLE_QUAL","scene_id":"S14_AUDIO_VISUAL_TEXTO","kind":"source_bound_qualification","authority":"PHYSICALLY_MEASURED","revision":"1ec6a2e561b2e7f67569242dbd3fbaebc724defa","uri":"github:file:forensics/references/screenrecording_20260826/golden/s14/fidelity/s14_fidelity_1ec6.json@12592bd8f8149767fafcb0ad0aa6036250ce540c","equivalence_proof_id":"S14_OUTPUT_EQUIV"},
    {"evidence_id":"S14_AUDIO_QUAL","scene_id":"S14_AUDIO_VISUAL_TEXTO","kind":"audio_timing_qualification","authority":"PHYSICALLY_MEASURED","revision":"1ec6a2e561b2e7f67569242dbd3fbaebc724defa","uri":"github:file:forensics/references/screenrecording_20260826/golden/s14/fidelity/s14_audio_qualification_1ec6.json@12592bd8f8149767fafcb0ad0aa6036250ce540c","equivalence_proof_id":"S14_OUTPUT_EQUIV"},

    {"evidence_id":"S16_EXACT_ARTIFACT","scene_id":"S16_FACTOR_X","kind":"workflow_artifact","authority":"PHYSICALLY_MEASURED","revision":"8e6fcb79d0d7958c0f023f128297059c97a7e674","uri":"github:artifact:9801246395","digest":"sha256:d4c46db77186ecacde60568b5530c36e19f24dceabaf97e7dbad5da1a51b4ceb"},
    {"evidence_id":"S16_EXACT_REVERIFY","scene_id":"S16_FACTOR_X","kind":"source_bound_exact_head_reverification","authority":"PHYSICALLY_MEASURED","revision":"8e6fcb79d0d7958c0f023f128297059c97a7e674","uri":"drive:1hEoRqLYVk3rMUrlLKH1VS174JsO8Tj-O","notes":"Independent exact-head remeasurement: layout proxy 1.0 IoU for column/question/Factor-X layout and audio timing proxy max error 0.902109f; full 9D remains false."},
    {"evidence_id":"S16_PROXY_REVIEW_EQUIV","scene_id":"S16_FACTOR_X","kind":"output_equivalence_proof","authority":"PHYSICALLY_MEASURED","revision":"8e6fcb79d0d7958c0f023f128297059c97a7e674","uri":"drive:1hEoRqLYVk3rMUrlLKH1VS174JsO8Tj-O"},
    {"evidence_id":"S16_PROXY_REVIEW","scene_id":"S16_FACTOR_X","kind":"advisory_source_vs_render_review","authority":"PHYSICALLY_MEASURED","revision":"e34b38061e2ad1d322238a011f5c6b9660b883ee","uri":"github:file:forensics/references/screenrecording_20260826/golden/s16/fidelity/s16_production_proxy_review_e34b.json@8e6fcb79d0d7958c0f023f128297059c97a7e674","equivalence_proof_id":"S16_PROXY_REVIEW_EQUIV"},

    {"evidence_id":"PROGRAM_CROSS_SCENE_EQUIV","scene_id":"PROGRAM","kind":"cross_scene_output_equivalence","authority":"PHYSICALLY_MEASURED","uri":"github:file:forensics/references/screenrecording_20260826/golden/aggregate_9d/cross_scene_output_equivalence.json"}
  ],
  "claims": [
    {"claim_id":"S04_TEMPORAL_LAYOUT","scene_id":"S04_CIENTIFICAMENTE","dimension":"temporal","semantic_target":"caption_layout_and_audio_event_timing","claim_kind":"source_bound_layout_timing","required":true,"status":"QUALIFIED","authority":"PHYSICALLY_MEASURED","evidence_ids":["S04_SOURCE_QUAL","S04_EXACT_ARTIFACT"],"scope":"setup/hero/tail timing and declared P0/P1 visible-layout gates; audio onset separately claimed","severity_if_unqualified":"P1"},
    {"claim_id":"S11_TEMPORAL_LAYOUT","scene_id":"S11_UI_LIST","dimension":"temporal","semantic_target":"ui_entry_and_row_timing","claim_kind":"source_bound_visible_timing","required":true,"status":"QUALIFIED","authority":"PHYSICALLY_MEASURED","evidence_ids":["S11_SOURCE_QUAL","S11_EXACT_ARTIFACT"],"scope":"pill, boxed word and three row visibility/timing","severity_if_unqualified":"P1"},
    {"claim_id":"S14_TEMPORAL_STATE","scene_id":"S14_AUDIO_VISUAL_TEXTO","dimension":"temporal","semantic_target":"state_card_heading_annotation_timing","claim_kind":"source_bound_state_timing","required":true,"status":"QUALIFIED","authority":"PHYSICALLY_MEASURED","evidence_ids":["S14_VISIBLE_QUAL","S14_EXACT_ARTIFACT"],"scope":"audio/visual/texto entry and exit state windows","severity_if_unqualified":"P1"},
    {"claim_id":"S16_TEMPORAL_PAYOFF","scene_id":"S16_FACTOR_X","dimension":"temporal","semantic_target":"foreground_payoff_layout_timing","claim_kind":"source_bound_layout_timing","required":true,"status":"QUALIFIED","authority":"PHYSICALLY_MEASURED","evidence_ids":["S16_EXACT_REVERIFY","S16_EXACT_ARTIFACT"],"scope":"column, question, Factor-X layout proxy and hold timing","severity_if_unqualified":"P1"},

    {"claim_id":"S04_MOTION_CURVES","scene_id":"S04_CIENTIFICAMENTE","dimension":"motion","semantic_target":"caption_and_reframe_kinematics_easing","claim_kind":"kinematic_curve","required":true,"status":"BLOCKED","authority":"UNKNOWN","evidence_ids":["S04_SOURCE_QUAL"],"scope":"screen-space layout is measured but original velocity/easing and reframe causality are not fully isolated","severity_if_unqualified":"P1","blocked_reason":"Original motion/easing curves and causal split between native subject motion and editorial reframe are not source-isolated."},
    {"claim_id":"S11_MOTION_KINEMATICS","scene_id":"S11_UI_LIST","dimension":"motion","semantic_target":"stagger_and_micro_motion_kinematics","claim_kind":"kinematic_curve","required":true,"status":"PARTIAL","authority":"PHYSICALLY_MEASURED","evidence_ids":["S11_SOURCE_QUAL"],"scope":"entry timing and visible boxes measured; velocity/easing/micro-motion not fully qualified","severity_if_unqualified":"P1","blocked_reason":"Source-bound geometry/timing does not yet qualify full per-frame velocity/easing grammar."},
    {"claim_id":"S14_MOTION_CAROUSEL","scene_id":"S14_AUDIO_VISUAL_TEXTO","dimension":"motion","semantic_target":"carousel_screen_space_trajectory","claim_kind":"screen_space_trajectory","required":true,"status":"QUALIFIED","authority":"PHYSICALLY_MEASURED","evidence_ids":["S14_VISIBLE_QUAL"],"scope":"per-frame card/heading/annotation trajectories in target-isolated measurement space","severity_if_unqualified":"P1"},